{
  "$schema": "./graph-spec.schema.json",
  "title": "Agent Communication — Experience",
  "alt": "Agent Communication — Experience: You, watching, Decisions page, Team Memory page, Coordinator graph",
  "direction": "LR",
  "nodes": [
    {
      "id": "U",
      "label": "You, watching",
      "icon": "box",
      "badge": {
        "text": "Step",
        "tone": "neutral"
      }
    },
    {
      "id": "D",
      "label": "Decisions page",
      "icon": "box",
      "badge": {
        "text": "Step",
        "tone": "neutral"
      },
      "subLabel": "inbox → ledger"
    },
    {
      "id": "M",
      "label": "Team Memory page",
      "icon": "database",
      "badge": {
        "text": "Data",
        "tone": "teal"
      },
      "subLabel": "learnings accumulate"
    },
    {
      "id": "G",
      "label": "Coordinator graph",
      "icon": "server",
      "badge": {
        "text": "Service",
        "tone": "green"
      },
      "subLabel": "handoffs + status"
    }
  ],
  "edges": [
    {
      "from": "U",
      "to": "D"
    },
    {
      "from": "U",
      "to": "M"
    },
    {
      "from": "U",
      "to": "G"
    },
    {
      "from": "D",
      "to": "G",
      "label": "team boundaries",
      "dashed": true
    },
    {
      "from": "M",
      "to": "G",
      "label": "shared knowledge",
      "dashed": true
    }
  ]
}
