{
  "$schema": "./graph-spec.schema.json",
  "title": "The six columns",
  "alt": "The six columns: Backlog, Ready, Active, Problems, Human Review, Done",
  "direction": "LR",
  "nodes": [
    {
      "id": "B",
      "label": "Backlog",
      "icon": "box",
      "badge": {
        "text": "Step",
        "tone": "neutral"
      }
    },
    {
      "id": "R",
      "label": "Ready",
      "icon": "box",
      "badge": {
        "text": "Step",
        "tone": "neutral"
      }
    },
    {
      "id": "A",
      "label": "Active",
      "icon": "box",
      "badge": {
        "text": "Step",
        "tone": "neutral"
      }
    },
    {
      "id": "P",
      "label": "Problems",
      "icon": "box",
      "badge": {
        "text": "Step",
        "tone": "neutral"
      }
    },
    {
      "id": "H",
      "label": "Human Review",
      "icon": "globe",
      "badge": {
        "text": "Client",
        "tone": "lavender"
      }
    },
    {
      "id": "D",
      "label": "Done",
      "icon": "box",
      "badge": {
        "text": "Step",
        "tone": "neutral"
      }
    }
  ],
  "edges": [
    {
      "from": "B",
      "to": "R",
      "label": "You drag"
    },
    {
      "from": "R",
      "to": "A",
      "label": "Heartbeat promotes"
    },
    {
      "from": "A",
      "to": "P",
      "label": "Failure"
    },
    {
      "from": "A",
      "to": "H",
      "label": "Needs approval"
    },
    {
      "from": "H",
      "to": "D",
      "label": "Approved"
    },
    {
      "from": "H",
      "to": "A",
      "label": "Request changes"
    }
  ]
}
