{
  "$schema": "./graph-spec.schema.json",
  "title": "Selection Logic",
  "alt": "Selection Logic: Registry available set, Order default first, Use available workflow set, Apply valid backlog/user override, Available count, Use the only workflow, Build selector prompt, Model returns JSON id + rationale, Known id?, Selected workflow, Default fallback",
  "direction": "TB",
  "nodes": [
    {
      "id": "Registry",
      "label": "Registry available set",
      "icon": "window",
      "badge": {
        "text": "Service",
        "tone": "teal"
      }
    },
    {
      "id": "DefaultFirst",
      "label": "Order default first",
      "icon": "window",
      "badge": {
        "text": "Service",
        "tone": "teal"
      }
    },
    {
      "id": "Candidates",
      "label": "Use available workflow set",
      "icon": "window",
      "badge": {
        "text": "Service",
        "tone": "teal"
      }
    },
    {
      "id": "OverrideCheck",
      "label": "Apply valid backlog/user override",
      "icon": "window",
      "badge": {
        "text": "Service",
        "tone": "teal"
      }
    },
    {
      "id": "Count",
      "label": "Available count",
      "icon": "window",
      "badge": {
        "text": "Service",
        "tone": "teal"
      }
    },
    {
      "id": "Single",
      "label": "Use the only workflow",
      "icon": "window",
      "badge": {
        "text": "Service",
        "tone": "teal"
      },
      "subLabel": "no model call"
    },
    {
      "id": "Prompt",
      "label": "Build selector prompt",
      "icon": "window",
      "badge": {
        "text": "Service",
        "tone": "teal"
      },
      "subLabel": "goal + roles + candidates"
    },
    {
      "id": "Model",
      "label": "Model returns JSON id + rationale",
      "icon": "branch",
      "badge": {
        "text": "External",
        "tone": "lavender"
      }
    },
    {
      "id": "Parse",
      "label": "Known id?",
      "icon": "window",
      "badge": {
        "text": "Service",
        "tone": "teal"
      }
    },
    {
      "id": "Selected",
      "label": "Selected workflow",
      "icon": "server",
      "badge": {
        "text": "Compute",
        "tone": "green"
      }
    },
    {
      "id": "Default",
      "label": "Default fallback",
      "icon": "window",
      "badge": {
        "text": "Service",
        "tone": "teal"
      }
    }
  ],
  "edges": [
    {
      "from": "Registry",
      "to": "DefaultFirst"
    },
    {
      "from": "DefaultFirst",
      "to": "Candidates"
    },
    {
      "from": "Candidates",
      "to": "OverrideCheck"
    },
    {
      "from": "OverrideCheck",
      "to": "Count"
    },
    {
      "from": "OverrideCheck",
      "to": "Selected",
      "label": "override wins"
    },
    {
      "from": "Count",
      "to": "Default",
      "label": "0"
    },
    {
      "from": "Count",
      "to": "Single",
      "label": "1"
    },
    {
      "from": "Single",
      "to": "Selected"
    },
    {
      "from": "Count",
      "to": "Prompt",
      "label": "many"
    },
    {
      "from": "Prompt",
      "to": "Model"
    },
    {
      "from": "Model",
      "to": "Parse"
    },
    {
      "from": "Parse",
      "to": "Selected",
      "label": "yes"
    },
    {
      "from": "Parse",
      "to": "Default",
      "label": "no"
    }
  ]
}
